episode_no	title	source	type	series	published	duration	captured_on	evidence_tier	status	file_path	url	notes
1	Why DePIN is the Future: Market Growth & Token Economics	Fluence	Video transcript	The DePIN Token Economics Report		4:53		third_party_secondary	pending	raw/		Market framing; verify market-size figures with primary reports.
2	What is DePIN? The Future of Decentralized Infrastructure	Fluence	Video transcript	The DePIN Token Economics Report		6:22		third_party_secondary	pending	raw/		Definition and taxonomy framing.
3	DePIN Tokenomics: How Token Models Shape the Market	Fluence	Video transcript	The DePIN Token Economics Report		7:05		third_party_secondary	pending	raw/		Token model overview; verify mechanism details with primary docs.
4	DePIN & Payments: Why Fiat Integration is the Future	Fluence	Video transcript	The DePIN Token Economics Report		4:22		third_party_secondary	pending	raw/		Potential input for subsidy-gap and revenue-baseline framing.
5	DePIN Rewards: How Incentives Shape the Network	Fluence	Video transcript	The DePIN Token Economics Report		4:26		third_party_secondary	pending	raw/		Potential input for reward-addiction framing.
6	DePIN Staking: Why Token Collateral Matters	Fluence	Video transcript	The DePIN Token Economics Report		6:26		third_party_secondary	pending	raw/		Potential input for trust and anti-fraud incentives.
7	DePIN Buy & Burn: How Token Burns Create Value	Fluence	Video transcript	The DePIN Token Economics Report		5:47		third_party_secondary	pending	raw/		Potential input for burn_fraction and emission interactions.
8	DePIN Governance: Who Controls the Network?	Fluence	Video transcript	The DePIN Token Economics Report		5:28		third_party_secondary	pending	raw/		Potential input for governance concentration discussion.
9	DePIN Tokenomics: Key Takeaways & Future Outlook	Fluence	Video transcript	The DePIN Token Economics Report		2:31		third_party_secondary	pending	raw/		Synthesis episode; use as narrative summary support only.
